{
  "schema": "actproof.field_derivations.v1",
  "profile_id": "op:eu.dora.ict_incident_notification_initial.v1",
  "field_derivations": [
    {
      "field_id": "entity_legal_identifier",
      "required": true,
      "derivation_type": "direct_template_field",
      "source_atoms": [
        "src.eu.dora.32025R0302.annexI.entity_lei",
        "src.eu.dora.32025R0302.annexII.data_glossary"
      ],
      "mapping_confidence": "draft",
      "interpretive_load": 0,
      "derivation_note": "The field is a direct institutional identifier in the reporting template and glossary instructions.",
      "non_claims": [],
      "release_scope": "required_release_scope",
      "binding_granularity": "template_field"
    },
    {
      "field_id": "entity_legal_name",
      "required": true,
      "derivation_type": "direct_template_field",
      "source_atoms": [
        "src.eu.dora.32025R0302.annexI.entity_name",
        "src.eu.dora.32025R0302.annexII.data_glossary"
      ],
      "mapping_confidence": "draft",
      "interpretive_load": 0,
      "derivation_note": "The field is a direct institutional identity field in the reporting template.",
      "non_claims": [],
      "release_scope": "required_release_scope",
      "binding_granularity": "template_field"
    },
    {
      "field_id": "financial_entity_type",
      "required": true,
      "derivation_type": "transformed_template_field",
      "source_atoms": [
        "src.eu.dora.32025R0302.annexI.financial_entity_type",
        "src.eu.dora.32025R0302.annexII.data_glossary",
        "src.eu.dora.32022R2554.art19.reporting_obligation"
      ],
      "mapping_confidence": "draft",
      "interpretive_load": 2,
      "derivation_note": "The field records the regulated-entity category using the template and glossary context; selection depends on the entity taxonomy.",
      "non_claims": [],
      "release_scope": "required_release_scope",
      "binding_granularity": "template_field"
    },
    {
      "field_id": "submission_type",
      "required": true,
      "derivation_type": "direct_template_metadata",
      "source_atoms": [
        "src.eu.dora.32025R0302.annexI.submission_type",
        "src.eu.dora.32022R2554.art19.p4.initial_intermediate_final"
      ],
      "mapping_confidence": "draft",
      "interpretive_load": 0,
      "derivation_note": "The field identifies the reporting stage in the DORA incident-reporting sequence.",
      "non_claims": [],
      "release_scope": "required_release_scope",
      "binding_granularity": "template_field"
    },
    {
      "field_id": "incident_reference_code",
      "required": true,
      "derivation_type": "normalised_template_field",
      "source_atoms": [
        "src.eu.dora.32025R0302.annexI.incident_reference_code",
        "src.eu.dora.32025R0302.annexII.data_glossary"
      ],
      "mapping_confidence": "draft",
      "interpretive_load": 1,
      "derivation_note": "The field normalises the institution’s incident reference into the reporting-template identifier field.",
      "non_claims": [],
      "release_scope": "required_release_scope",
      "binding_granularity": "template_field"
    },
    {
      "field_id": "detection_datetime_utc",
      "required": true,
      "derivation_type": "normalised_time_field",
      "source_atoms": [
        "src.eu.dora.32025R0302.annexI.detection_datetime",
        "src.eu.dora.32025R0301.art5.time_limits",
        "src.eu.dora.32025R0302.annexII.data_glossary"
      ],
      "mapping_confidence": "draft",
      "interpretive_load": 1,
      "derivation_note": "The field normalises the detection timestamp for time-limit and reporting-template purposes.",
      "non_claims": [],
      "release_scope": "required_release_scope",
      "binding_granularity": "template_field"
    },
    {
      "field_id": "classification_datetime_utc",
      "required": true,
      "derivation_type": "reconciled_time_field",
      "source_atoms": [
        "src.eu.dora.32025R0302.annexI.classification_datetime",
        "src.eu.dora.32025R0301.art5.time_limits",
        "src.eu.dora.32022R2554.art19.p4.initial_intermediate_final"
      ],
      "mapping_confidence": "draft",
      "interpretive_load": 3,
      "derivation_note": "The field reconciles the classification timestamp with the reporting sequence and timing rules.",
      "non_claims": [
        "does_not_constitute_final_legal_classification"
      ],
      "release_scope": "required_release_scope",
      "binding_granularity": "template_field"
    },
    {
      "field_id": "classification_criteria_triggered",
      "required": true,
      "derivation_type": "interpretive_classification_mapping",
      "source_atoms": [
        "src.eu.dora.32025R0302.annexI.classification_criteria",
        "src.eu.dora.32024R1772.art1to7.classification_criteria",
        "src.eu.dora.32024R1772.art8.major_incident_determination",
        "src.eu.dora.32025R0301.art2.initial_notification_content"
      ],
      "mapping_confidence": "draft",
      "interpretive_load": 4,
      "derivation_note": "The field records which classification criteria were triggered. The template carries the field; the classification RTS supplies the substantive criteria; the initial-notification RTS supplies the content context.",
      "non_claims": [
        "does_not_constitute_final_legal_classification",
        "does_not_replace_competent_authority_assessment"
      ],
      "release_scope": "required_release_scope",
      "binding_granularity": "template_field"
    },
    {
      "field_id": "affected_member_states",
      "required": true,
      "derivation_type": "reconciled_jurisdiction_field",
      "source_atoms": [
        "src.eu.dora.32025R0302.annexI.affected_member_states",
        "src.eu.dora.32025R0302.annexII.data_glossary",
        "src.eu.dora.32025R0301.art2.initial_notification_content"
      ],
      "mapping_confidence": "draft",
      "interpretive_load": 3,
      "derivation_note": "The field reconciles template reporting with operational analysis of affected jurisdictions.",
      "non_claims": [],
      "release_scope": "required_release_scope",
      "binding_granularity": "template_field"
    },
    {
      "field_id": "incident_discovery_method",
      "required": true,
      "derivation_type": "transformed_operational_field",
      "source_atoms": [
        "src.eu.dora.32025R0302.annexI.discovery_method",
        "src.eu.dora.32025R0302.annexII.data_glossary"
      ],
      "mapping_confidence": "draft",
      "interpretive_load": 2,
      "derivation_note": "The field transforms operational detection context into the reporting-template discovery-method field.",
      "non_claims": [],
      "release_scope": "required_release_scope",
      "binding_granularity": "template_field"
    },
    {
      "field_id": "business_continuity_plan_activated",
      "required": true,
      "derivation_type": "normalised_boolean_field",
      "source_atoms": [
        "src.eu.dora.32025R0302.annexI.bcp_activated",
        "src.eu.dora.32025R0301.art2.initial_notification_content"
      ],
      "mapping_confidence": "draft",
      "interpretive_load": 1,
      "derivation_note": "The field normalises business-continuity activation evidence into a boolean reporting field.",
      "non_claims": [],
      "release_scope": "required_release_scope",
      "binding_granularity": "template_field"
    },
    {
      "field_id": "initial_impact_description",
      "required": true,
      "derivation_type": "modelled_narrative_field",
      "source_atoms": [
        "src.eu.dora.32025R0302.annexI.initial_impact_description",
        "src.eu.dora.32025R0301.art2.initial_notification_content"
      ],
      "mapping_confidence": "draft",
      "interpretive_load": 4,
      "derivation_note": "The field models a provisional narrative impact description from the initial-notification content requirement and reporting template.",
      "non_claims": [
        "does_not_constitute_final_impact_assessment"
      ],
      "release_scope": "required_release_scope",
      "binding_granularity": "template_field"
    },
    {
      "field_id": "primary_contact_name",
      "required": true,
      "derivation_type": "direct_contact_field",
      "source_atoms": [
        "src.eu.dora.32025R0302.annexI.primary_contact_name",
        "src.eu.dora.32025R0302.annexII.data_glossary"
      ],
      "mapping_confidence": "draft",
      "interpretive_load": 0,
      "derivation_note": "The field is a direct contact-information field in the reporting template.",
      "non_claims": [],
      "release_scope": "required_release_scope",
      "binding_granularity": "template_field"
    },
    {
      "field_id": "primary_contact_email",
      "required": true,
      "derivation_type": "direct_contact_field",
      "source_atoms": [
        "src.eu.dora.32025R0302.annexI.primary_contact_email",
        "src.eu.dora.32025R0302.annexII.data_glossary"
      ],
      "mapping_confidence": "draft",
      "interpretive_load": 0,
      "derivation_note": "The field is a direct contact-email field in the reporting template.",
      "non_claims": [],
      "release_scope": "required_release_scope",
      "binding_granularity": "template_field"
    },
    {
      "field_id": "competent_authority",
      "required": true,
      "derivation_type": "transformed_reporting_channel_field",
      "source_atoms": [
        "src.eu.dora.32022R2554.art19.competent_authority_channel",
        "src.eu.dora.32025R0302.annexI.competent_authority"
      ],
      "mapping_confidence": "draft",
      "interpretive_load": 2,
      "derivation_note": "The field links the reporting channel and competent-authority context to the operational recipient field.",
      "non_claims": [
        "does_not_determine_national_supervisory_routing"
      ],
      "release_scope": "required_release_scope",
      "binding_granularity": "template_field"
    },
    {
      "field_id": "secondary_contact_name",